{
  "$schema": "http://json-schema.org/draft-07/schema#",
  "title": "Схема конфигурационного файла пресетов погоды",
  "definitions": {
    "weatherPreset": {
      "type": "object",
      "required": ["CloudConfig", "CloudLevel", "CloudHeight", "Turbulence", "PrecLevel", "PrecType"],
      "additionalProperties": false,
      "properties": {
        "CloudConfig": {
          "type": "string"
        },
        "CloudLevel": {
          "type": "string"
        },
        "CloudHeight": {
          "type": "string"
        },
        "Turbulence": {
          "type": "string"
        },
        "PrecLevel": {
          "type": "string"
        },
        "PrecType": {
          "type": "string"
        }
      }
    }
  },
  "required": ["$schema", "maps", "moscow", "stalingrad", "kuban"],
  "additionalProperties": false,
  "properties": {
    "$schema": {},
    "maps": {
      "type": "array",
      "title": "Доступные в конфиге карты",
      "items": {
        "enum": ["moscow", "stalingrad", "kuban"]
      }
    },
    "weibull_parameter": {
      "type": "number",
      "title": "Параметр распределения Вейбулла для генерации погоды.",
      "description": "Чем ближе к 1, тем чаще будут выпадать неблагоприятные пресеты (приближение к равномерному распределнию). При 10 90% будет на 4й и 5й пресеты погоды.",
      "minimum": 1,
      "default": 2.4,
      "maximum": 10
    },
    "moscow": {
      "type": "object",
      "title": "Пресеты погоды для ТВД Москвы",
      "required": ["au", "wi"],
      "additionalProperties": false,
      "properties": {
        "au": {
          "type": "object",
          "title": "Летний сезон",
          "patternProperties": {
            "^\\d+$": {
              "$ref": "#/definitions/weatherPreset"
            }
          }
        },
        "wi": {
          "type": "object",
          "title": "Осенний сезон",
          "patternProperties": {
            "^\\d+$": {
              "$ref": "#/definitions/weatherPreset"
            }
          }
        }
      }
    },
    "stalingrad": {
      "type": "object",
      "title": "Пресеты погоды для ТВД Сталинграда",
      "required": ["wi", "su", "au"],
      "additionalProperties": false,
      "properties": {
        "wi": {
          "type": "object",
          "title": "Зимний сезон",
          "patternProperties": {
            "^\\d+$": {
              "$ref": "#/definitions/weatherPreset"
            }
          }
        },
        "su": {
          "type": "object",
          "title": "Летний сезон",
          "patternProperties": {
            "^\\d+$": {
              "$ref": "#/definitions/weatherPreset"
            }
          }
        },
        "au": {
          "type": "object",
          "title": "Осенний сезон",
          "patternProperties": {
            "^\\d+$": {
              "$ref": "#/definitions/weatherPreset"
            }
          }
        }
      }
    },
    "kuban": {
      "type": "object",
      "title": "Пресеты погоды для ТВД Кубани",
      "required": ["su", "au"],
      "additionalProperties": false,
      "properties": {
        "su": {
          "type": "object",
          "title": "Летний сезон",
          "patternProperties": {
            "^\\d+$": {
              "$ref": "#/definitions/weatherPreset"
            }
          }
        },
        "au": {
          "type": "object",
          "title": "Осенний сезон",
          "patternProperties": {
            "^\\d+$": {
              "$ref": "#/definitions/weatherPreset"
            }
          }
        }
      }
    }
  }
}
